[
  {
    "paper_id": "paper_000001",
    "source_record": {
      "title_en": "FDM-DEM coupled method investigation of NASA’s InSight HP3 mole: dynamic cone penetration challenges and enhancements on mars",
      "title_zh": "NASA洞察号HP3鼹鼠的FDM-DEM耦合方法研究：火星动态锥形穿透挑战及增强",
      "authors": [
        "Barzegar, Yahya",
        "Ghanbari, Ali"
      ],
      "year": 2025,
      "journal": "Advances in Space Research",
      "doi": "10.1016/j.asr.2025.07.104",
      "abstract": "The InSight mission’s mole penetrator, launched by NASA in 2018 to study Mars’ thermal properties, encountered significant challenges when it managed to penetrate only 40 cm into the Martian surface, much less than anticipated due to the presence of an unexpectedly harder subsurface duricrust, which proved far more resistant than scientists had predicted. This study therefore assesses how variations in mars’ soils’ density, porosity and ice content affects penetration depth as well as performance. Also, it considers how mechanical vibrations can improve penetration efficiency in future space explorations. The Discrete Element Method (DEM) and Finite Difference Method (FDM) were combined for modeling and the updated soil characteristics from the InSight mission allowed the model to more accurately capture the increased resistance encountered during penetration, highlighting the crucial roles of porosity and soil density in the behavior of Martian soil during such processes. It was noticed that when vertical load was combined with vibration frequency, the strategic use of vibration led to great improvements in terms of penetration depth compared to situations where no such vibration technique was employed. Besides, the impact of vibration was more pronounced in the Martian gravity environment compare to the Earth gravity. Additionally, the presence of ice within the Martian soil leads to heightened resistance during penetration, a phenomenon that is further amplified by the Martian gravity environment in comparison to Earth’s gravity. Higher ice concentrations could substantially limit the effectiveness of subsurface exploration tools on Mars, posing challenges for future missions targeting icy regions. © 2025 COSPAR. Published by Elsevier B.V. All rights are reserved, including those for text and data mining, AI training, and similar technologies."
    },
    "screening_info": {
      "decision": "include",
      "screen_stage": "title_abstract",
      "reason": "标题和摘要提到火星表面穿透挑战和效率提升，与地下钻进机器人推进与破土机制相关。",
      "confidence": 0.95
    },
    "content_summary": {
      "one_sentence_summary": "研究了火星表面硬度和土壤特性对NASA洞察号HP3鼹鼠穿透效率的影响，并探讨了振动技术在提高穿透深度方面的潜力。",
      "core_summary": "本研究分析了NASA洞察号HP3鼹鼠在火星表面穿透时遇到的挑战，特别是由于火星表面硬度和土壤特性导致的穿透深度远低于预期的问题。研究通过FDM-DEM耦合方法模拟了土壤密度、孔隙度和冰含量对穿透深度的影响，并探讨了机械振动如何提高穿透效率。研究发现，振动技术在火星重力环境下对提高穿透深度有显著效果，而冰的存在则增加了穿透难度。",
      "research_focus": "火星表面穿透挑战与振动技术提升效率",
      "value_for_topic": "提供了火星表面硬度和土壤特性对地下钻进机器人穿透效率影响的深入分析，以及振动技术在提高穿透深度方面的应用潜力，对地下钻进机器人的设计和优化具有重要参考价值。",
      "limitations": "研究主要基于模拟和已有的火星土壤数据，对于实际火星环境下的长期稳定性和适应性还有待进一步验证。"
    },
    "classification": {
      "primary_category": "地下钻进机器人技术",
      "secondary_category": null,
      "study_type": "建模研究",
      "application_context": "火星表面穿透",
      "core_problem": "火星表面硬度和土壤特性对地下钻进机器人穿透效率的影响",
      "method_keywords": [
        "FDM-DEM耦合",
        "火星土壤特性",
        "穿透效率",
        "振动技术"
      ],
      "domain_tags": [
        "火星探测",
        "地下钻进",
        "土壤力学",
        "振动辅助"
      ]
    },
    "reporting_flags": {
      "recommended_level": "high",
      "is_key_paper": true
    }
  },
  {
    "paper_id": "paper_000003",
    "source_record": {
      "title_en": "Small penetrator instrument concept for the advancement of lunar surface science",
      "title_zh": "月球表面科学推进的小穿透器仪器概念",
      "authors": [
        "Ahrens, C.J.",
        "Paige, D.A.",
        "Eubanks, T.M.",
        "Blase, W.P.",
        "Mesick, K.E.",
        "Zimmerman, W.",
        "Petro, N.",
        "Hayne, P.O.",
        "Price, S."
      ],
      "year": 2021,
      "journal": "Planetary Science Journal",
      "doi": "10.3847/psj/abda4f",
      "abstract": "Fundamental scientific objectives concerning the surface and subsurface material and dynamics of the Moon are the drivers for the use and advancement of penetrators, which emplace a suite of scientific instruments by impact into a planetary surface, typically at velocities of dozens to hundreds of meters per second. Small lunar penetrators are poised to become a valuable new tool for lunar science and exploration during the next decade. These low-cost ballistic probes can be deployed in large numbers from orbit, or from descending robotic or crewed vehicles, in order to explore and characterize the diversity of extreme lunar shallow subsurface environments. In this paper, we describe the general overview of penetrator objectives, potential instrumentation, and how these would benefit the advancement of lunar science at various extreme environments. © 2021. The Author(s). Published by the American Astronomical Society."
    },
    "screening_info": {
      "decision": "include",
      "screen_stage": "title_abstract",
      "reason": "标题和摘要提到月球表面科学和小穿透器的使用，与地下钻进机器人推进与破土机制相关。",
      "confidence": 0.95
    },
    "content_summary": {
      "one_sentence_summary": "本文探讨了小型月球穿透器作为科学仪器的概念，旨在通过撞击部署到月球表面以推进月球表面科学。",
      "core_summary": "文章讨论了小型月球穿透器的科学目标、潜在仪器配置以及它们如何有助于在极端月球浅层地下环境中推进月球科学。这些低成本的弹道探测器可以从轨道或下降中的机器人或载人车辆中大量部署，以探索和表征极端月球浅层地下环境的多样性。",
      "research_focus": "月球表面科学和小穿透器应用",
      "value_for_topic": "提供了月球表面科学中小型穿透器的设计概念和应用前景，对地下钻进机器人的推进与破土机制研究具有参考价值。",
      "limitations": "文章主要讨论月球环境，可能与地球地下环境的钻进机器人推进与破土机制存在差异，需要进一步研究其在地球环境的适用性。"
    },
    "classification": {
      "primary_category": "地下钻进技术",
      "secondary_category": null,
      "study_type": "方法设计",
      "application_context": "月球表面科学",
      "core_problem": "如何利用小型穿透器在月球表面部署科学仪器",
      "method_keywords": [
        "月球穿透器",
        "科学仪器",
        "表面科学",
        "弹道部署"
      ],
      "domain_tags": [
        "月球探索",
        "机器人技术",
        "地下钻进",
        "科学仪器"
      ]
    },
    "reporting_flags": {
      "recommended_level": "high",
      "is_key_paper": true
    }
  },
  {
    "paper_id": "paper_000004",
    "source_record": {
      "title_en": "The response of dry and wet silica sand to high velocity impact",
      "title_zh": "干湿硅砂对高速冲击的响应",
      "authors": [
        "Kuwik, B.S.",
        "Moreno, J.",
        "Shaeffer, M.",
        "Simpson, G.",
        "Hurley, R.C."
      ],
      "year": 2024,
      "journal": "International Journal of Impact Engineering",
      "doi": "10.1016/j.ijimpeng.2024.104883",
      "abstract": "Understanding the mechanisms governing the interaction of high-velocity projectiles and sand targets is important for numerous applications and industries. The high-velocity penetration of sand targets is known to be controlled by micromechanical phenomena; however, our quantification of these phenomena and our understanding of water saturation effects on target response is presently limited. To help improve our understanding of these phenomena, we performed impact experiments on wet and dry sand with in-situ and post-mortem analysis in a two-stage gas gun with varying impact chamber pressures. For in-situ analysis, we developed and used a novel experimental method for measuring projectile depth and three-dimensional displacement fields from orthogonal flash X-ray images acquired during the penetration process. We also employed in-situ high-speed imaging of ejecta. For post-mortem analysis, we examined final depths of penetration, particle size distributions, and permanent penetrator deformation. We found that impacts into wet sand targets featured enhanced sand displacements around projectiles, enhanced ejecta, and enhanced intermediate and final depths of penetration as compared to impacts into dry targets. We also found that impacts into wet targets led to less particle breakage than impacts into dry targets. Target chamber pressure was found to significantly influence final depth of penetration, likely through a fluidization process as air and fluid escaped the sample's pores to equilibrate with the surrounding chamber pressure after initial impact. We discuss our findings in the context of existing literature and discuss the hypothesized origin of several of our observations with support from modeling efforts described elsewhere. © 2024 Elsevier Ltd"
    },
    "screening_info": {
      "decision": "include",
      "screen_stage": "title_abstract",
      "reason": "摘要提到高速度穿透沙目标的实验，与地下钻进机器人推进与破土机制相关。",
      "confidence": 0.95
    },
    "content_summary": {
      "one_sentence_summary": "本研究通过实验探究了干湿硅砂在高速冲击下的反应差异。",
      "core_summary": "研究通过在两级气体炮中进行实验，分析了干湿硅砂在高速冲击下的行为差异。实验包括现场分析和事后分析，开发了新的实验方法来测量穿透过程中的弹体深度和三维位移场，并使用高速成像技术观察抛射物。研究发现湿砂目标在冲击下表现出更大的砂位移、更强的抛射物和更深的穿透深度，且湿砂目标的颗粒破碎程度低于干砂目标。",
      "research_focus": "高速冲击下干湿砂的响应差异",
      "value_for_topic": "提供了地下钻进机器人在不同土质条件下推进和破土机制的实验数据和理论分析，有助于理解机器人在实际应用中的性能表现。",
      "limitations": "研究主要关注砂土的物理响应，对于地下钻进机器人的具体设计和操作参数的直接影响尚需进一步研究。"
    },
    "classification": {
      "primary_category": "地下钻进技术",
      "secondary_category": null,
      "study_type": "实验研究",
      "application_context": null,
      "core_problem": "干湿砂在高速冲击下的行为差异",
      "method_keywords": [
        "高速冲击",
        "砂土响应",
        "实验分析",
        "三维位移场"
      ],
      "domain_tags": [
        "地下工程",
        "土力学",
        "机器人技术",
        "材料科学"
      ]
    },
    "reporting_flags": {
      "recommended_level": "high",
      "is_key_paper": true
    }
  },
  {
    "paper_id": "paper_000005",
    "source_record": {
      "title_en": "Preparation Method of Lunar Soil Simulant and Experimental Verification of the Performance of an Impact Penetrator for Lunar Soil Exploration",
      "title_zh": "月壤模拟材料制备方法及月壤探测冲击穿透器性能实验验证",
      "authors": [
        "Li, He",
        "Li, Yuanbo",
        "Wei, Minyu",